{
  "schema_version": "1.0.0",
  "case_id": "eiffel-tower-relocation",
  "description": "Synthetic fixture for exercising the AuditCase contract.",
  "edit": {
    "subject": "The Eiffel Tower",
    "prompt_template": "{subject} is located in",
    "target_new": " Rome",
    "target_original": " Paris"
  },
  "probes": {
    "exact": [
      {
        "probe_id": "exact-1",
        "prompt": "The Eiffel Tower is located in"
      }
    ],
    "paraphrase": [
      {
        "probe_id": "paraphrase-1",
        "prompt": "You can find the Eiffel Tower in"
      }
    ],
    "locality": [
      {
        "probe_id": "locality-1",
        "prompt": "The Colosseum is located in"
      }
    ],
    "portability": [
      {
        "probe_id": "portability-1",
        "prompt": "The country containing the city of the Eiffel Tower is",
        "expected_relationship": {
          "relation": "entails",
          "target": " Italy"
        }
      }
    ],
    "control": [
      {
        "probe_id": "control-1",
        "prompt": "Water freezes at"
      }
    ]
  },
  "provenance": {
    "dataset_name": "KEditAudit synthetic fixtures",
    "dataset_version": "1",
    "dataset_license": "CC0-1.0",
    "source": "urn:kedit-audit:fixture:eiffel-tower-relocation",
    "record_id": "synthetic-001"
  }
}
